{
  "版": 1,
  "要求ID": "aaaaaaaaaaaaaaaaaaaaaaaaaaaaaaaa",
  "要求hash": "sha256:bbbbbbbbbbbbbbbbbbbbbbbbbbbbbbbbbbbbbbbbbbbbbbbbbbbbbbbbbbbbbbbb",
  "部分保存破棄承認監査ID": "broker-audit-21",
  "観測監査head": "sha256:cccccccccccccccccccccccccccccccccccccccccccccccccccccccccccccccc",
  "観測時刻": 1789000000,
  "状態": "部分破棄中断照合済み",
  "証拠種別": "LIVE_RUNTIME"
}
